DOI,Title,Open Access URL,Open Access Status,Journal,Cited By,Year
10.3390/su12198030,Evaluation of Key Performance Indicators (KPIs) for Sustainable Postgraduate Medical Training: An Opportunity for Implementing an Innovative Approach to Advance the Quality of Training Programs at the Saudi Commission for Health Specialties (SCFHS),https://www.mdpi.com/2071-1050/12/19/8030/pdf,gold,,21.0,2020.0
10.1016/j.autcon.2020.103304,Web-GIS approach to preventive conservation of heritage buildings,https://oa.upm.es/62885/1/Manuscript_Sanchez_Aparicio.pdf,green,,84.0,2020.0
10.1007/s11187-019-00208-y,Data science for entrepreneurship research: studying demand dynamics for entrepreneurial skills in the Netherlands,https://link.springer.com/content/pdf/10.1007/s11187-019-00208-y.pdf,hybrid,,96.0,2019.0
10.1007/s11431-020-1581-2,Smart additive manufacturing: Current artificial intelligence-enabled methods and future perspectives,https://doi.org/10.1007/s11431-020-1581-2,closed,,74.0,2020.0
10.1016/j.compeleceng.2020.106736,Street-centric routing scheme using ant colony optimization-based clustering for bus-based vehicular ad-hoc network,https://doi.org/10.1016/j.compeleceng.2020.106736,closed,,30.0,2020.0
10.1088/2632-2153/ab9a20,Scientific AI in materials science: a path to a sustainable and scalable paradigm,https://doi.org/10.1088/2632-2153/ab9a20,gold,,69.0,2020.0
10.1016/j.jsr.2020.06.014,Adaptive automation and its health and safety challenges,https://doi.org/10.1016/j.jsr.2020.06.014,closed,,2.0,2020.0
10.1108/ITSE-02-2020-0022,Integration of Industrial Revolution 4.0 and IOTs in academia: a state-of-the-art review on the concept of Education 4.0 in Pakistan,https://doi.org/10.1108/itse-02-2020-0022,closed,,62.0,2020.0
10.1016/j.jebo.2020.07.014,"Robots, computers, and the gender wage gap",https://www.sciencedirect.com/science/article/am/pii/S0167268120302365,bronze,,38.0,2020.0
10.1080/17487870.2019.1565411,Is the Fourth Industrial Revolution a window of opportunity for upgrading or reinforcing the middle-income trap? Asian model of development in Southeast Asia,https://doi.org/10.1080/17487870.2019.1565411,closed,,58.0,2019.0
10.1109/TFUZZ.2019.2928787,Collective Scenario Understanding in a Multivehicle System by Consensus Decision Making,https://doi.org/10.1109/tfuzz.2019.2928787,closed,,20.0,2019.0
10.1007/s00146-019-00915-w,Automation for the artisanal economy: enhancing the economic and environmental sustainability of crafting professions with human–machine collaboration,http://deepblue.lib.umich.edu/bitstream/2027.42/150492/1/Eglash%20et%20al.%20accepted%20in%202019.pdf,closed,,29.0,2019.0
10.1111/risa.13425,Deep Learning Models for Health and Safety Risk Prediction in Power Infrastructure Projects,https://doi.org/10.1111/risa.13425,closed,,75.0,2019.0
10.3390/su12208492,A Review of 3D Printing in Construction and its Impact on the Labor Market,https://www.mdpi.com/2071-1050/12/20/8492/pdf?version=1602729177,gold,,214.0,2020.0
10.1371/journal.pcbi.1008023,OSS-DBS: Open-source simulation platform for deep brain stimulation with a comprehensive automated modeling,https://journals.plos.org/ploscompbiol/article/file?id=10.1371/journal.pcbi.1008023&type=printable,gold,,47.0,2020.0
10.1016/j.euroecorev.2020.103443,Automation and labor force participation in advanced economies: Macro and micro evidence,https://doi.org/10.1016/j.euroecorev.2020.103443,closed,,82.0,2020.0
10.1016/j.dss.2020.113290,Employees recruitment: A prescriptive analytics approach via machine learning and mathematical programming,https://doi.org/10.1016/j.dss.2020.113290,green,,194.0,2020.0
10.1016/j.lrp.2019.05.006,Surviving on the long tail: An empirical investigation of business model elements for mass customization,https://doi.org/10.1016/j.lrp.2019.05.006,closed,,33.0,2019.0
10.1016/j.tele.2020.101404,Facial-expression recognition: An emergent approach to the measurement of tourist satisfaction through emotions,https://doi.org/10.1016/j.tele.2020.101404,closed,,95.0,2020.0
10.1016/j.telpol.2020.101976,AI governance in the public sector: Three tales from the frontiers of automated decision-making in democratic settings,https://doi.org/10.1016/j.telpol.2020.101976,green,,387.0,2020.0
10.1007/s10462-019-09783-8,On multi-resident activity recognition in ambient smart-homes,https://arxiv.org/pdf/1806.06611,closed,,29.0,2019.0
10.1016/j.labeco.2020.101862,Labor market polarization in Britain and Germany: A cross-national comparison using longitudinal household data,https://doi.org/10.1016/j.labeco.2020.101862,closed,,4.0,2020.0
10.1016/j.telpol.2020.101910,Should humans work?,https://munin.uit.no/bitstream/10037/30935/3/article.pdf,green,,4.0,2020.0
10.1007/s10111-019-00585-0,Ant Colony Optimization Algorithm for understanding of trade-offs between safety and benefit: a case of Beijing taxi service system,https://doi.org/10.1007/s10111-019-00585-0,closed,,2.0,2019.0
10.3390/su12156100,Adapting Universities for Sustainability Education in Industry 4.0: Channel of Challenges and Opportunities,https://www.mdpi.com/2071-1050/12/15/6100/pdf,gold,,236.0,2020.0
10.1061/(ASCE)CO.1943-7862.0001849,Construction Activity Recognition and Ergonomic Risk Assessment Using a Wearable Insole Pressure System,https://doi.org/10.1061/(asce)co.1943-7862.0001849,closed,,55.0,2020.0
10.1016/j.comcom.2020.06.005,Uncovering spatiotemporal and semantic aspects of tourists mobility using social sensing,http://arxiv.org/pdf/2005.09033,green,,28.0,2020.0
10.1016/j.jmsy.2020.07.001,Utilization of a reinforcement learning algorithm for the accurate alignment of a robotic arm in a complete soft fabric shoe tongues automation process,https://doi.org/10.1016/j.jmsy.2020.07.001,closed,,27.0,2020.0
10.3390/su12135302,"Climate and Ties in Workplace versus Sense of Danger and Stress, Based on Empirical Research in the Aviation Industry",https://www.mdpi.com/2071-1050/12/13/5302/pdf?version=1593612767,gold,,6.0,2020.0
10.3390/SU12104035,Influences of the Industry 4.0 Revolution on the Human Capital Development and Consumer Behavior: A Systematic Review,https://www.mdpi.com/2071-1050/12/10/4035/pdf?version=1589469726,gold,,664.0,2020.0
10.1093/cjres/rsz022,The wrong kind of AI? Artificial intelligence and the future of labour demand,https://dspace.mit.edu/bitstream/1721.1/135974.2/1/The%20Wrong%20Kind%20of%20AI%20-%20Artificial%20Intelligence%20and,green,,387.0,2019.0
10.1093/cjres/rsaa003,"No automation please, we’re British: technology and the prospects for work",https://eprints.whiterose.ac.uk/159007/3/CJRES%20No%20automation%20please_Final_Oct%20%28submitted%29.pdf,green,,26.0,2020.0
10.1016/j.cor.2020.104930,A multiperiod workforce scheduling and routing problem with dependent tasks,http://arxiv.org/pdf/2008.02849,green,,27.0,2020.0
10.1016/j.cie.2020.106463,Industrial human resource management optimization based on skills and characteristics,https://doi.org/10.1016/j.cie.2020.106463,closed,,25.0,2020.0
10.1016/j.ejor.2019.02.002,Multiobjective evolutionary algorithms for strategic deployment of resources in operational units,https://doi.org/10.1016/j.ejor.2019.02.002,hybrid,,10.0,2019.0
10.1080/10803548.2018.1502131,Bayesian network model to diagnose WMSDs with working characteristics,https://doi.org/10.1080/10803548.2018.1502131,closed,,17.0,2018.0
10.1016/j.infoandorg.2019.100286,Beyond design and use: How scholars should study intelligent technologies,https://doi.org/10.1016/j.infoandorg.2019.100286,closed,,139.0,2019.0
10.1093/cjres/rsz027,Redeployment or robocalypse? Workers and automation in Ohio manufacturing SMEs,https://doi.org/10.1093/cjres/rsz027,bronze,,18.0,2019.0
10.1016/j.ssci.2019.104593,The future of safety science,https://pure.hud.ac.uk/ws/files/19736085/AAM_The_future_of_safety_Science_3_nov_2019.pdf,green,,46.0,2020.0
10.3390/su12093606,Design of Human-Centered Collaborative Assembly Workstations for the Improvement of Operators’ Physical Ergonomics and Production Efficiency: A Case Study,https://www.mdpi.com/2071-1050/12/9/3606/pdf?version=1588261509,gold,,130.0,2020.0
10.1177/0891242420911712,Impact of Property Tax Abatement on Employment Growth,https://doi.org/10.1177/0891242420911712,closed,,6.0,2020.0
10.1109/TNSE.2019.2917071,Incentive Mechanism Based Cooperative Spectrum Sharing for OFDM Cognitive IoT Network,https://doi.org/10.1109/tnse.2019.2917071,closed,,67.0,2019.0
10.1016/j.autcon.2020.103150,Automated staff assignment for building maintenance using natural language processing,https://doi.org/10.1016/j.autcon.2020.103150,closed,,66.0,2020.0
10.1093/cjres/rsaa001,The platform economy: restructuring the space of capitalist accumulation,https://doi.org/10.1093/cjres/rsaa001,bronze,,220.0,2020.0
10.1177/0309816819899410,The platform as factory: Crowdwork and the hidden labour behind artificial intelligence,https://doi.org/10.1177/0309816819899410,closed,,153.0,2020.0
10.1093/cjres/rsz019,"Robots, skill demand and manufacturing in US regional labour markets",https://doi.org/10.1093/cjres/rsz019,closed,,36.0,2019.0
10.1093/cjres/rsaa004,When machines think for us: the consequences for work and place,https://academic.oup.com/cjres/article-pdf/13/1/3/33213532/rsaa004.pdf,bronze,,84.0,2020.0
10.1108/OIR-10-2018-0334,Algorithmic equity in the hiring of underrepresented IT job candidates,https://doi.org/10.1108/oir-10-2018-0334,closed,,87.0,2019.0
10.3390/su12072789,"Artificial Intelligence, Transport and the Smart City: Definitions and Dimensions of a New Mobility Era",https://www.mdpi.com/2071-1050/12/7/2789/pdf,gold,,337.0,2020.0
10.1093/icc/dtz039,"Automation and productivity—a cross-country, cross-industry comparison",https://academic.oup.com/icc/article-pdf/29/2/265/32932765/dtz039.pdf,bronze,,114.0,2019.0
10.1111/ina.12635,"Prevalence of sick building syndrome symptoms and its associated factors among bank employees in Pokhara Metropolitan, Nepal",https://doi.org/10.1111/ina.12635,gold,,28.0,2019.0
10.1109/TPAMI.2018.2889473,Efficient and Robust Approximate Nearest Neighbor Search Using Hierarchical Navigable Small World Graphs,https://arxiv.org/pdf/1603.09320,green,,1018.0,2018.0
10.1021/acs.chemmater.9b03686,Artificial Intelligence to Accelerate the Discovery of N<sub>2</sub> Electroreduction Catalysts,https://doi.org/10.1021/acs.chemmater.9b03686,closed,,82.0,2019.0
10.1080/17538963.2019.1681201,The effect of artificial intelligence on China’s labor market,https://www.tandfonline.com/doi/pdf/10.1080/17538963.2019.1681201?needAccess=true,closed,,68.0,2019.0
10.1016/j.autcon.2020.103085,Deep learning for site safety: Real-time detection of personal protective equipment,https://www.sciencedirect.com/science/article/am/pii/S0926580519308325,bronze,,338.0,2020.0
10.1080/0960085X.2020.1728200,The complementarity of autonomy and control in mobile work,https://www.tandfonline.com/doi/pdf/10.1080/0960085X.2020.1728200?needAccess=true,hybrid,,30.0,2020.0
10.3390/educsci10030046,An Experiential Online Training Approach for Underrepresented Engineering and Technology Students,https://www.mdpi.com/2227-7102/10/3/46/pdf,gold,,4.0,2020.0
10.1353/ECA.2020.0003,Does the US Tax Code Favor Automation?,https://dspace.mit.edu/bitstream/1721.1/144421/2/SSRN-id3586184.pdf,green,,65.0,2020.0
10.1007/s10676-019-09512-3,"Presumptuous aim attribution, conformity, and the ethics of artificial social cognition",https://link.springer.com/content/pdf/10.1007/s10676-019-09512-3.pdf,hybrid,,7.0,2019.0
10.1109/TII.2019.2950109,Smart Collaborative Automation for Receive Buffer Control in Multipath Industrial Networks,https://doi.org/10.1109/tii.2019.2950109,closed,,87.0,2019.0
10.1108/FS-03-2019-0014,How capitalism abolishes itself in the digital era in favour of <i>robo-economic systems</i>: socio-economic implications of decentralized autonomous self-owned businesses,https://doi.org/10.1108/fs-03-2019-0014,closed,,6.0,2019.0
10.1016/j.jsr.2019.12.017,"Perceptions of safety on a shared road: Driving, cycling, or walking near an autonomous vehicle",https://doi.org/10.1016/j.jsr.2019.12.017,closed,,91.0,2020.0
10.1109/TII.2019.2926574,An Industrial Analysis Technology About Occupational Adaptability and Association Rules in Social Networks,https://doi.org/10.1109/tii.2019.2926574,hybrid,,9.0,2019.0
10.3390/ijms21041534,"Micronucleus Assay: The State of Art, and Future Directions",https://europepmc.org/articles/pmc7073234?pdf=render,green,,248.0,2020.0
10.1061/(ASCE)SC.1943-5576.0000465,Scenarios for Integrating IPS–IMU System with BIM Technology in Construction Safety Control,https://doi.org/10.1061/(asce)sc.1943-5576.0000465,closed,,27.0,2019.0
10.1016/j.compind.2019.103162,Robotic Process Automation: Contemporary themes and challenges,https://dspace.library.uu.nl/bitstream/handle/1874/395182/1_s2.0_S0166361519304609_main.pdf?sequence=1&isAllowed=y,green,,419.0,2019.0
10.1093/oxrep/graa051,Do technological advances reduce the gender wage gap?,https://academic.oup.com/oxrep/article-pdf/36/4/903/36154838/graa051.pdf,hybrid,,30.0,2020.0
10.1109/ACCESS.2020.3024891,An AIoT Based Smart Agricultural System for Pests Detection,https://ieeexplore.ieee.org/ielx7/6287639/8948470/09200475.pdf,gold,,167.0,2020.0
10.1016/j.aiia.2020.06.001,Artificial cognition for applications in smart agriculture: A comprehensive review,https://doi.org/10.1016/j.aiia.2020.06.001,gold,,161.0,2020.0
10.1177/2053951720919776,"The trainer, the verifier, the imitator: Three ways in which human platform workers support artificial intelligence",https://journals.sagepub.com/doi/pdf/10.1177/2053951720919776,gold,,162.0,2020.0
10.1016/j.aiia.2020.04.002,Implementation of artificial intelligence in agriculture for optimisation of irrigation and application of pesticides and herbicides,https://doi.org/10.1016/j.aiia.2020.04.002,gold,,650.0,2020.0
10.1155/2020/8301575,Functional and Social Team Dynamics in Industrial Settings,https://downloads.hindawi.com/journals/complexity/2020/8301575.pdf,gold,,1.0,2020.0
10.1109/ACCESS.2020.2999096,BPCM: A Flexible High-Speed Bypass Parallel Communication Mechanism for GPU Cluster,https://ieeexplore.ieee.org/ielx7/6287639/8948470/09104965.pdf,gold,,4.0,2020.0
10.1080/14747731.2020.1791380,"Goodbye<i>labouring man</i>, long live<i>homo economicus</i>: the new precarity in the world of work",https://doi.org/10.1080/14747731.2020.1791380,closed,,5.0,2020.0
10.1016/j.arcontrol.2020.04.009,Operations management issues in design and control of hybrid human-robot collaborative manufacturing systems: a survey,https://doi.org/10.1016/j.arcontrol.2020.04.009,bronze,,112.0,2020.0
10.1057/s41267-019-00265-1,Enforcing higher labor standards within developing country value chains: Consequences for MNEs and informal actors in a dual economy,https://centaur.reading.ac.uk/84144/1/Labour%20standards%20compliance%20informal%20economy%20narula%204.pdf,closed,,138.0,2019.0
10.1016/j.labeco.2019.101750,Markets for jobs and their task overlap,https://dspace.library.uu.nl/bitstream/handle/1874/388069/1_s2.0_S0927537119300764_main.pdf?sequence=1&isAllowed=y,green,,15.0,2019.0
10.1007/s10845-018-1423-x,Product quality in an inclusive manufacturing system: some considerations,https://doi.org/10.1007/s10845-018-1423-x,closed,,5.0,2018.0
10.1007/s12369-019-00594-z,The Religious Impacts of Taoism on Ethically Aligned Design in HRI,https://doi.org/10.1007/s12369-019-00594-z,closed,,16.0,2019.0
10.1007/s12063-019-00143-x,Modelling the barriers of Health 4.0–the fourth healthcare industrial revolution in India by TISM,https://link.springer.com/content/pdf/10.1007/s12063-019-00143-x.pdf,closed,,78.0,2019.0
10.3390/su11236761,Management Premises and Barriers in the Metal Industry in Poland in the Context of Innovative Activity,https://www.mdpi.com/2071-1050/11/23/6761/pdf?version=1575452738,gold,,4.0,2019.0
10.1007/s10845-018-1416-9,Industrial wearable system: the human-centric empowering technology in Industry 4.0,https://doi.org/10.1007/s10845-018-1416-9,closed,,176.0,2018.0
10.1016/j.cmpb.2019.105063,Development of an automatic muscle atrophy measuring algorithm to calculate the ratio of supraspinatus in supraspinous fossa using deep learning,https://doi.org/10.1016/j.cmpb.2019.105063,closed,,37.0,2019.0
10.3390/su11236676,Human Factor Preparedness for Decentralized Crisis Management and Communication in Cyber-Physical Systems,https://www.mdpi.com/2071-1050/11/23/6676/pdf?version=1574752560,gold,,10.0,2019.0
10.1038/s41746-019-0106-0,Physician perspectives on integration of artificial intelligence into diagnostic pathology,https://www.nature.com/articles/s41746-019-0106-0.pdf,gold,,235.0,2019.0
10.1016/j.artmed.2019.101753,Artificial intelligence and the future of psychiatry: Insights from a global physician survey,https://arxiv.org/pdf/1907.12386,green,,163.0,2019.0
10.1109/ACCESS.2019.2962072,Learning From Accidents: Machine Learning for Safety at Railway Stations,https://ieeexplore.ieee.org/ielx7/6287639/8948470/08941092.pdf,gold,,56.0,2019.0
10.1016/j.shaw.2019.09.005,"The Fourth Industrial Revolution and Its Impact on Occupational Health and Safety, Worker's Compensation and Labor Conditions",https://doi.org/10.1016/j.shaw.2019.09.005,gold,,199.0,2019.0
10.2514/1.G004279,Space Situational Awareness Sensor Tasking: Comparison of Machine Learning with Classical Optimization Methods,https://doi.org/10.2514/1.g004279,bronze,,29.0,2019.0
10.1016/j.ssci.2019.08.012,Exploring eye-tracking searching strategies for construction hazard recognition in a laboratory scene,https://doi.org/10.1016/j.ssci.2019.08.012,closed,,65.0,2019.0
10.1016/j.shaw.2019.09.003,Automated Systems and Trust: Mineworkers' Trust in Proximity Detection Systems for Mobile Machines,https://doi.org/10.1016/j.shaw.2019.09.003,gold,,5.0,2019.0
10.1007/s12599-019-00595-2,Hybrid Intelligence,https://arxiv.org/pdf/2105.00691,closed,,342.0,2019.0
10.1016/j.ssci.2017.05.007,Applying Analytic Hierarchy Process (AHP) to choose a human factors technique: Choosing the suitable Human Reliability Analysis technique for the automotive industry,https://iris.polito.it/bitstream/11583/2674868/1/SAFETY-D-17-00010R1%20%281%29.pdf,green,,86.0,2017.0
10.3390/su11216133,"Perceptions of the Impact of High-Level-Machine-Intelligence from University Students in Taiwan: The Case for Human Professions, Autonomous Vehicles, and Smart Homes",https://www.mdpi.com/2071-1050/11/21/6133/pdf?version=1572775749,gold,,11.0,2019.0
10.3390/su11216123,Are Emotionally Intelligent People More Creative? A Meta-Analysis of the Emotional Intelligence–Creativity Link,https://www.mdpi.com/2071-1050/11/21/6123/pdf?version=1573202379,gold,,61.0,2019.0
10.1080/03043797.2019.1657632,A third approach beyond the false dichotomy between teacher- and student-centred approaches in the engineering classroom,https://doi.org/10.1080/03043797.2019.1657632,closed,,9.0,2019.0
10.1007/s11042-019-7367-0,An efficient employment of internet of multimedia things in smart and future agriculture,https://doi.org/10.1007/s11042-019-7367-0,closed,,124.0,2019.0
10.1016/j.respol.2019.03.010,Is this time different? How digitalization influences job creation and destruction,https://orbilu.uni.lu/bitstream/10993/39183/1/Balsmeier_Woerter_Is%20this%20time%20different%20-%20RP%20-%202019_pub.pdf,green,,343.0,2019.0
10.1016/j.apergo.2019.05.004,RGB-D ergonomic assessment system of adopted working postures,https://doi.org/10.1016/j.apergo.2019.05.004,closed,,71.0,2019.0
10.1093/EPOLIC/EIAA001,Automation and jobs: when technology boosts employment*,https://scholarship.law.bu.edu/cgi/viewcontent.cgi?article=1809&context=faculty_scholarship,closed,,220.0,2019.0
10.1016/j.autcon.2019.102934,Robotic autonomous systems for earthmoving in military applications,https://opus.lib.uts.edu.au/bitstream/10453/135674/6/OCC-146902_AM.pdf,green,,90.0,2019.0
10.1016/j.jeem.2019.102253,Climate policies and skill-biased employment dynamics: Evidence from EU countries,https://www.sciencedirect.com/science/article/am/pii/S0095069618304911,bronze,,115.0,2019.0
10.1016/j.resourpol.2019.101420,Indigenous peoples and mine automation: An issues paper,https://doi.org/10.1016/j.resourpol.2019.101420,closed,,31.0,2019.0
10.1016/j.rtbm.2020.100458,How technology commitment affects mode choice for a self-driving shuttle service,https://doi.org/10.1016/j.rtbm.2020.100458,closed,,31.0,2019.0
10.1016/j.conbuildmat.2019.05.140,"Additive manufacturing of cementitious composites: Materials, methods, potentials, and challenges",https://doi.org/10.1016/j.conbuildmat.2019.05.140,closed,,153.0,2019.0
10.1111/obes.12298,Automation and Job Polarization: On the Decline of Middling Occupations in Europe,https://econpapers.repec.org/scripts/redir.pf?u=http%3A%2F%2Fdiposit.ub.edu%2Fdspace%2Fbitstream%2F2445%2F102038%2F1%2FE16-348_Jerbashian_Automatization.pdf;h=repec:ewp:wpaper:348web,green,,25.0,2019.0
10.1093/EPOLIC/EIAA004,Why is labour receiving a smaller share of global income?*,https://doi.org/10.1093/epolic/eiaa004,closed,,66.0,2019.0
10.1016/j.compbiomed.2019.103448,Automatic nystagmus detection and quantification in long-term continuous eye-movement data,https://ueaeprints.uea.ac.uk/id/eprint/72280/1/Accepted_Manuscript.pdf,green,,20.0,2019.0
10.1145/3359313,Human-AI Collaboration in Data Science,http://arxiv.org/pdf/1909.02309,green,,221.0,2019.0
10.1145/3338243,Human-Machine Collaboration for Content Regulation,https://dl.acm.org/doi/pdf/10.1145/3338243,bronze,,230.0,2019.0
10.1080/03085147.2019.1620027,Will we work in twenty-first century capitalism? A critique of the fourth industrial revolution literature,https://eprints.leedsbeckett.ac.uk/id/eprint/5952/1/WillWeWorkInTwentyFirstCenturyCapitalismAM-MORGAN.pdf,green,,106.0,2019.0
10.1109/LRA.2019.2895273,Autonomous Flexible Endoscope for Minimally Invasive Surgery With Enhanced Safety,https://doi.org/10.1109/lra.2019.2895273,closed,,87.0,2019.0
10.3390/su11164481,Universal Basic Income and Inclusive Capitalism: Consequences for Sustainability,https://www.mdpi.com/2071-1050/11/16/4481/pdf?version=1566204696,gold,,23.0,2019.0
10.1016/j.compchemeng.2019.04.003,Advances and opportunities in machine learning for process data analytics,https://doi.org/10.1016/j.compchemeng.2019.04.003,closed,,294.0,2019.0
10.1016/j.neucom.2019.02.061,Physiological-signal-based mental workload estimation via transfer dynamical autoencoders in a deep learning framework,https://oda.oslomet.no/oda-xmlui/bitstream/10642/8338/1/Physiological-signal-based%2bmental%2bworkload%2bestimation%2bvia%2btransfer%2bdynamical%2bautoencoders%2bin%2ba%2bdeep%2blearning%2bframework.pdf,green,,37.0,2019.0
10.1016/j.ssci.2019.04.025,Real-time locating systems and safety in construction sites: A literature review,https://eprints.qut.edu.au/128717/2/128717.pdf,green,,98.0,2019.0
10.1007/s40812-019-00119-9,"Fourth industrial revolution concepts in the automotive sector: performativity, work and employment",https://doi.org/10.1007/s40812-019-00119-9,closed,,27.0,2019.0
10.3390/su11174778,Social Responsibility toward the Employees and Career Development Sustainability during Manufacturing Transformation in China,https://www.mdpi.com/2071-1050/11/17/4778/pdf,gold,,18.0,2019.0
10.1111/jofi.12766,Labor‐Technology Substitution: Implications for Asset Pricing,https://doi.org/10.1111/jofi.12766,closed,,75.0,2019.0
10.1007/s40812-019-00122-0,"A fourth industrial revolution? Digital transformation, labor and work organization: a view from Spain",https://doi.org/10.1007/s40812-019-00122-0,closed,,45.0,2019.0
10.1007/s40812-019-00123-z,Is this time different? A note on automation and labour in the fourth industrial revolution,https://doi.org/10.1007/s40812-019-00123-z,closed,,25.0,2019.0
10.1016/j.biosystemseng.2019.06.013,Robotics and labour in agriculture. A context consideration,http://eprints.lincoln.ac.uk/id/eprint/36279/3/EU_WEST_1-prod-s3-ucmdata-evise-6710133c307ae035ad867a6149b8227b-C_O6465047_3347779.pdf,closed,,229.0,2019.0
10.1016/j.artmed.2019.101724,Automated plaque classification using computed tomography angiography and Gabor transformations,https://doi.org/10.1016/j.artmed.2019.101724,closed,,17.0,2019.0
10.1016/j.apergo.2019.04.004,Work design for airport security officers: Effects of rest break schedules and adaptable automation,https://doi.org/10.1016/j.apergo.2019.04.004,hybrid,,15.0,2019.0
10.1016/j.shaw.2019.06.006,Design and Development of an Ergonomic Trolley-Lifter for Sheet Metal Handling Task: A Preliminary Study,https://doi.org/10.1016/j.shaw.2019.06.006,gold,,17.0,2019.0
10.1109/TASE.2018.2884723,Inertial Sensor-Based Slip Detection in Human Walking,https://doi.org/10.1109/tase.2018.2884723,bronze,,42.0,2019.0
10.1016/j.chb.2019.04.012,Does the use of synchrony and artificial intelligence in video interviews affect interview ratings and applicant attitudes?,https://doi.org/10.1016/j.chb.2019.04.012,closed,,153.0,2019.0
10.1016/j.rtbm.2019.100384,The gendered impacts of technological change for public transport workers in the Global South,https://qmro.qmul.ac.uk/xmlui/bitstream/123456789/62918/3/Wright%20The%20gendered%20impacts%20of%20technological%20change%20for%20public%20transport%20workers%20in%20the%20Global%20South%202019%20Accepted.pdf,green,,6.0,2019.0
10.1016/j.matdes.2019.107651,An approach to develop printable strain hardening cementitious composites,https://doi.org/10.1016/j.matdes.2019.107651,gold,,183.0,2019.0
10.1002/hbe2.140,Digital inequalities in the age of artificial intelligence and big data,https://onlinelibrary.wiley.com/doi/pdfdirect/10.1002/hbe2.140,gold,,274.0,2019.0
10.1016/j.infoecopol.2019.05.003,AI meets labor market: Exploring the link between automation and skills,https://doi.org/10.1016/j.infoecopol.2019.05.003,closed,,122.0,2019.0
10.1109/MCOM.2019.1601220,5G Ultra-Reliable Low-Latency Communications in Factory Automation Leveraging Licensed and Unlicensed Bands,https://doi.org/10.1109/mcom.2019.1601220,closed,,57.0,2019.0
